{
  "schemaVersion": 1,
  "id": "europe",
  "title": "Evropa",
  "description": "Offline výuková sada / Offline teaching pack",
  "language": "cs",
  "difficulty": "beginner",
  "tags": [],
  "unverified": true,
  "map": {
    "center": [
      12,
      50
    ],
    "longitudeSpan": 55,
    "showCountryBorders": true
  },
  "questions": [
    {
      "id": "paris",
      "prompt": "Kde leží Paříž?",
      "answerType": "point",
      "geometry": {
        "type": "Point",
        "coordinates": [
          2.3522,
          48.8566
        ]
      },
      "explanation": "Paříž leží na Seině. / Paris lies on the Seine.",
      "scoring": {
        "toleranceKm": 100
      },
      "hints": [],
      "tags": []
    },
    {
      "id": "rome",
      "prompt": "Kde leží Řím?",
      "answerType": "point",
      "geometry": {
        "type": "Point",
        "coordinates": [
          12.4964,
          41.9028
        ]
      },
      "explanation": "Řím leží na Tibeře. / Rome lies on the Tiber.",
      "scoring": {
        "toleranceKm": 100
      },
      "hints": [],
      "tags": []
    },
    {
      "id": "czechia",
      "prompt": "Vyznač Česko.",
      "answerType": "polygon",
      "geometry": {
        "type": "Polygon",
        "coordinates": [
          [
            [
              12.09,
              50.25
            ],
            [
              12.55,
              49.54
            ],
            [
              13.84,
              48.77
            ],
            [
              14.7,
              48.58
            ],
            [
              16.95,
              48.62
            ],
            [
              18.86,
              49.52
            ],
            [
              18.5,
              49.91
            ],
            [
              17.64,
              50.11
            ],
            [
              16.33,
              50.66
            ],
            [
              15.35,
              50.87
            ],
            [
              14.3,
              51.05
            ],
            [
              12.95,
              50.4
            ],
            [
              12.09,
              50.25
            ]
          ]
        ]
      },
      "explanation": "Česko sousedí s Německem, Polskem, Slovenskem a Rakouskem. Hranice jsou zjednodušené. / Czechia borders Germany, Poland, Slovakia and Austria.",
      "scoring": {
        "toleranceKm": 30
      },
      "hints": [],
      "tags": []
    }
  ]
}
